Scenario,C,trials.thisRepN,trials.thisTrialN,trials.thisN,trials.thisIndex,trials_2.thisRepN,trials_2.thisTrialN,trials_2.thisN,trials_2.thisIndex,IntroScreen.started,IntroScreen.stopped,instructions.started,instructions.stopped,scenario1.started,scenario1.stopped,notAtAll.started,notAtAll.stopped,veryMuch.started,veryMuch.stopped,lastRating,rating.response,rating.rt,rating.started,rating.stopped,riskBehaviorScaleScreen.started,riskBehaviorScaleScreen.stopped,activity.started,activity.stopped,notAtAll2.started,notAtAll2.stopped,ExtremelyLikely.started,ExtremelyLikely.stopped,rating2.response,rating2.rt,rating2.started,rating2.stopped,Rating,unlikely.started,unlikely.stopped,neutral.started,neutral.stopped,Likely.started,Likely.stopped,participant,session,sex,age,date,expName,psychopyVersion,frameRate,
Locating your car in a very large parking lot or parking garage.,,0,0,0,3,,,,,6.128697396008647,None,6.5287927520112135,None,6.9289852590009104,None,6.9289852590009104,None,6.9289852590009104,None,0.2,2,1.495,0.005938576199696399,None,,,,,,,,,,,,,,,,,,,,,001,,,2020_Oct_30_1732,Big5,2020.2.4,59.990179607896465,
Finding your way back to a familiar area after realizing you have made a wrong turn and become lost while driving.,,0,1,1,5,,,,,,,,,8.42897457300569,None,8.42897457300569,None,8.42897457300569,None,0.2,2,0.416,0.012907402197015472,None,,,,,,,,,,,,,,,,,,,,,001,,,2020_Oct_30_1732,Big5,2020.2.4,59.990179607896465,
"Pointing in the direction of a place outside that someone wants to get to and has asked you for directions, when you are in a windowless room.",,0,2,2,2,,,,,,,,,8.877895750003518,None,8.877895750003518,None,8.877895750003518,None,0.4,3,0.417,0.014766416206839494,None,,,,,,,,,,,,,,,,,,,,,001,,,2020_Oct_30_1732,Big5,2020.2.4,59.990179607896465,
Finding your way out of a complex arrangement of offices that you have visited for the first time.,,0,3,3,1,,,,,,,,,9.328616229002364,None,9.328616229002364,None,9.328616229002364,None,0.4,3,0.405,0.001881071599200368,None,,,,,,,,,,,,,,,,,,,,,001,,,2020_Oct_30_1732,Big5,2020.2.4,59.990179607896465,
Leaving a store that you have been to for the first time and deciding which way to turn to get to a destination.,,0,4,4,0,,,,,,,,,9.762135639000917,None,9.762135639000917,None,9.762135639000917,None,0.6000000000000001,4,0.507,0.0016912095888983458,None,,,,,,,,,,,,,,,,,,,,,001,,,2020_Oct_30_1732,Big5,2020.2.4,59.990179607896465,
Trying a new route that you think will be a shortcut without the benefit of a map.,,0,5,5,4,,,,,,,,,10.295078837007168,None,10.295078837007168,None,10.295078837007168,None,0.6000000000000001,4,0.41,0.005899461611988954,None,,,,,,,,,,,,,,,,,,,,,001,,,2020_Oct_30_1732,Big5,2020.2.4,59.990179607896465,
Finding your way around in an unfamiliar mall.,,0,6,6,6,,,,,,,,,10.728982811007882,None,10.728982811007882,None,10.728982811007882,None,0.6000000000000001,4,0.408,0.005118188593769446,None,,,,,,,,,,,,,,,,,,,,,001,,,2020_Oct_30_1732,Big5,2020.2.4,59.990179607896465,
Finding your way to an appointment in an area of a city or town with which you are not familiar. ,,0,7,7,7,,,,,,,,,11.162126395007363,None,11.162126395007363,None,11.162126395007363,None,0.6000000000000001,4,0.407,0.00349071659729816,None,,,,,,,,,,,,,,,,,,,,,001,,,2020_Oct_30_1732,Big5,2020.2.4,59.990179607896465,
,Admitting that your tastes are different from those of your friends. (S),,,,,0,0,0,0,,,,,,,,,,,,,,,,11.578887612005929,None,11.696015834007994,None,11.696015834007994,None,11.696015834007994,None,4,0.757,0.00028621758974622935,None,3.0,11.696015834007994,None,11.696015834007994,None,11.696015834007994,None,,001,,,2020_Oct_30_1732,Big5,2020.2.4,59.990179607896465,
,Arguing with a friend who has a very different opinion on an issue. (S),,,,,0,1,1,1,,,,,,,,,,,,,,,,,,12.478304832009599,None,12.478304832009599,None,12.478304832009599,None,4,0.409,0.00550688459770754,None,3.0,12.478304832009599,None,12.478304832009599,None,12.478304832009599,None,,001,,,2020_Oct_30_1732,Big5,2020.2.4,59.990179607896465,
,Asking your boss for a raise. (S),,,,,0,2,2,2,,,,,,,,,,,,,,,,,,12.911727144004544,None,12.911727144004544,None,12.911727144004544,None,3,0.41,0.006639973595156334,None,2.0,12.911727144004544,None,12.911727144004544,None,12.911727144004544,None,,001,,,2020_Oct_30_1732,Big5,2020.2.4,59.990179607896465,
,Betting a day's income at the horse races. (F),,,,,0,3,3,3,,,,,,,,,,,,,,,,,,13.345879830012564,None,13.345879830012564,None,13.345879830012564,None,3,0.46,0.004729347594548017,None,2.0,13.345879830012564,None,13.345879830012564,None,13.345879830012564,None,,001,,,2020_Oct_30_1732,Big5,2020.2.4,59.990179607896465,
,Buying an illegal drug for your own use. (E),,,,,0,4,4,4,,,,,,,,,,,,,,,,,,13.828788623010041,None,13.828788623010041,None,13.828788623010041,None,3,0.411,0.0060254355921642855,None,2.0,13.828788623010041,None,13.828788623010041,None,13.828788623010041,None,,001,,,2020_Oct_30_1732,Big5,2020.2.4,59.990179607896465,
,Chasing a tornado by car to take photos that you can sell to the press ®,,,,,0,5,5,5,,,,,,,,,,,,,,,,,,14.260944768000627,None,14.260944768000627,None,14.260944768000627,None,3,0.439,0.0016811116074677557,None,2.0,14.260944768000627,None,14.260944768000627,None,14.260944768000627,None,,001,,,2020_Oct_30_1732,Big5,2020.2.4,59.990179607896465,
,Cheating a fair amount on your income tax. (E) ,,,,,0,6,6,6,,,,,,,,,,,,,,,,,,14.744980497998768,None,14.744980497998768,None,14.744980497998768,None,3,0.441,0.004391088601551019,None,2.0,14.744980497998768,None,14.744980497998768,None,14.744980497998768,None,,001,,,2020_Oct_30_1732,Big5,2020.2.4,59.990179607896465,
,Cheating on an exam. (E) ,,,,,0,7,7,7,,,,,,,,,,,,,,,,,,15.21213794000505,None,15.21213794000505,None,15.21213794000505,None,3,0.744,0.0047177466040011495,None,2.0,15.21213794000505,None,15.21213794000505,None,15.21213794000505,None,,001,,,2020_Oct_30_1732,Big5,2020.2.4,59.990179607896465,
,Co-signing a new car loan for a friend. (F),,,,,0,8,8,8,,,,,,,,,,,,,,,,,,15.978214027010836,None,15.978214027010836,None,15.978214027010836,None,3,0.506,0.0024169005919247866,None,2.0,15.978214027010836,None,15.978214027010836,None,15.978214027010836,None,,001,,,2020_Oct_30_1732,Big5,2020.2.4,59.990179607896465,
,Dating someone that you are working with. (S),,,,,0,9,9,9,,,,,,,,,,,,,,,,,,16.511147971003084,None,16.511147971003084,None,16.511147971003084,None,3,0.541,0.0036983595928177238,None,2.0,16.511147971003084,None,16.511147971003084,None,16.511147971003084,None,,001,,,2020_Oct_30_1732,Big5,2020.2.4,59.990179607896465,
,Deciding to share an apartment with someone you don't know well. (S),,,,,0,10,10,10,,,,,,,,,,,,,,,,,,17.078669435009942,None,17.078669435009942,None,17.078669435009942,None,3,0.488,0.006664805609034374,None,2.0,17.078669435009942,None,17.078669435009942,None,17.078669435009942,None,,001,,,2020_Oct_30_1732,Big5,2020.2.4,59.990179607896465,
,Disagreeing with your father on a major issue. (S),,,,,0,11,11,11,,,,,,,,,,,,,,,,,,17.59560375699948,None,17.59560375699948,None,17.59560375699948,None,3,0.526,0.005477738595800474,None,2.0,17.59560375699948,None,17.59560375699948,None,17.59560375699948,None,,001,,,2020_Oct_30_1732,Big5,2020.2.4,59.990179607896465,
